COMP34111,AI and Games,10,Optional,https://www.manchester.ac.uk/study/undergraduate/courses/2025/00560/bsc-computer-science/course-details/COMP34111,"The main contents of this module include:   1.  What is a game? (Definition of game, pay-off function, representations in normal form, and extensive form.) 2. What is a plan for decision-making in a game context? (Definition of strategy, representations of strategy.) 3. What does it mean to play a game well? (Definition of best-response strategy, equilibrium point, discussion of the validity of these concepts, discussion of alternatives.) 4. Properties of the Nash equilibrium. (How it incentivizes bad outcomes to prevent opponents from taking advantage.) 5. How do we find good game plans? (Complexity of finding equilibrium points, minimax algorithm, alpha-beta pruning, discussion of the components of a typical game playing program via evaluation function and alpha-beta search) 6. How do we learn good game plans? (Introduction to reinforcement learning, learning through ""self-play"", TD-learning, Monte Carlo Tree Search.)",No,10,,Semester 1,3,,,,,,,,,0.5,0.5,6.0,,1.0,1.0,0.0,,
COMP34212,Cognitive Robotics,10,Optional,https://www.manchester.ac.uk/study/undergraduate/courses/2025/00560/bsc-computer-science/course-details/COMP34212,"This unit provides an in-depth understanding of the field of cognitive robotics. This will analyse the selection, use and combination of methods and approaches in robotics, in artificial intelligence and in psychology and neuroscience to design intelligent behaviour and cognitive skills in interactive robots.",Yes,10,,Semester 2,3,,,,,,,,,0.3,0.7,6.0,,1.0,1.0,,,
COMP34312,Mathematical Topics in Machine Learning,10,Optional,https://www.manchester.ac.uk/study/undergraduate/courses/2025/00560/bsc-computer-science/course-details/COMP34312,"Topic 1: Empirical risk minimization, regularisation; bias/variance theory and the relation to overfitting; probabilistic view: likelihood vs loss, introducing exponential families.   Topic 2: Information theory: KL-divergence vs. cross-entropy, mutual information; the view of ML as compression.   Topic 3: Optimization theory (calculus). Why GD?  What are convex and non-convex functions? How do gradients inform how we optimize a function? How can we use second order properties? How can we prove whether a method will converge?   Topic 4: Dimensionality reduction (matrix algebra). “refine, denoise, and visualise your data”.  Data usually has limited degrees of interest, living on a low-dimensional manifold within a high-dimensional space. This topic will introduce students to matrix-algebra-intensive methods used to learn feature dimensions that can aid in your model fitting process. Examples include PCA, spectral embedding, Fisher discriminant analysis, etc. These allow visualisation, denoising and enhancing the separation of data for classification.",Yes,10,,Semester 2,3,,,,,,,,,0.2,0.8,6.0,,1.0,1.0,,,
COMP34612,Computational Game Theory,10,Optional,https://www.manchester.ac.uk/study/undergraduate/courses/2025/00560/bsc-computer-science/course-details/COMP34612,"There has been a substantial grow of research activity at the boundaries of game theory, artificial intelligence, economics, computer science, and a number of other disciplines in recent years. The reasons behind this are twofold: On the one hand, game theory and its applications raise many important and challenging computing, learning, and communication problems to CS and AI; On the other hand, game theory provides important insights and powerful frameworks to a number of CS topics, including AI, Multi-agent systems, computer networks as well as many others.   The main contents of this module include: 1) To introduce the concepts and computational solutions for non-cooperative and cooperative game theory with their applications 2) To introduce the machine learning techniques to solve the learning issues arise from the applications of game theory with their applications 3) To introduce the mechanism design (the reverse game theory) and its applications for the design of the rules of a game   The module includes a major piece of coursework (a group project run over 5 weeks) to apply game theory and learning methods covered to solve the pricing game problem.",No,10,,Semester 2,3,,,,,,,,,0.5,0.5,6.0,0.0,1.0,1.0,,,
COMP34711,Natural Language Processing,10,Optional,https://www.manchester.ac.uk/study/undergraduate/courses/2025/00560/bsc-computer-science/course-details/COMP34711,"This course unit will cover the key linguistic and algorithmic foundations of natural language processing. It will explore the main challenges in representing, searching and retrieving written documents, representing word semantics, and processing and identifying patterns in speech. It will consider both rule-based methods and machine/deep learning methods, and introduce key applications such as text information retrieval, text classification, word sense disambiguation, speech synthesis and speech recognition.",No,10,,Semester 1,3,,,,,,,,,0.3,0.7,6.0,,2.0,1.0,,,
COMP34812,Natural Language Understanding,10,Optional,https://www.manchester.ac.uk/study/undergraduate/courses/2025/00560/bsc-computer-science/course-details/COMP34812,"Drawing from concepts covered in the prerequisite COMP34711: Natural Language Processing unit, this unit will enable students to look more deeply into how machines analyse and recognise meaning expressed in natural language. In this unit, students will gain hands-on experience in investigating solutions to a number of natural language understanding tasks. This will provide students with the know-how required to develop technologies for real-world applications enabling communication between humans and machines, which have become increasingly ubiquitous and indispensable.",No,10,,Semester 2,3,,,,,0.3,,,,,0.7,6.0,,2.0,1.0,,,
COMP35112,Chip Multiprocessors,10,Optional,https://www.manchester.ac.uk/study/undergraduate/courses/2025/00560/bsc-computer-science/course-details/COMP35112,"Due to technological limitations, it is proving increasingly difficult to maintain a continual increase in the performance of individual processors. Therefore, the current trend is to integrate multiple processors on to a single chip and exploit the resulting parallel resources to achieve higher computing power. However, this may require significantly different approaches to both hardware and software particularly for general purpose applications. This course will explore these issues in detail.",Yes,10,,Semester 2,3,,,,,,,,,0.3,0.7,6.0,,2.0,,,,
COMP36111,Algorithms and Complexity,10,Optional,https://www.manchester.ac.uk/study/undergraduate/courses/2025/00560/bsc-computer-science/course-details/COMP36111,"The Unit constitutes a self-contained introduction to the theory of Computational Complexity. It assumes no pre-requisites other than a knowledge of basic algorithms and mathematical notation. The teaching will be exclusively by means of traditional lectures, supported by the prescribed course text.",Yes,10,,Semester 1,3,,,,,,,0.2,,,0.8,6.0,,2.0,,,,
COMP36212,Mathematical Systems and Computation,10,Optional,https://www.manchester.ac.uk/study/undergraduate/courses/2025/00560/bsc-computer-science/course-details/COMP36212,"Mathematical systems can be used to describe many aspects of the world around us, from modelling physics and chemistry, to predicting financial markets and enabling machine learning and AI. By modelling systems mathematically it is possible to analyse them, and make predictions about their performance and how it can be optimised. Solution of these mathematical systems often relies on computational hardware and the application of algorithms which solve an approximate form of the problem. It is therefore important to understand the limitations imposed by the computational implementation of a given problem, and the effect this can have on a given solution.   The course explores these concepts from three perspectives: by introducing the notion of finite precision computation and error propagation within a computational process; through exploring techniques for the numerical solution of differential equations; and through the use of optimisation algorithms to maximise the performance of a solution to a given problem. These techniques are then applied to real-world problems, including physical and engineering systems, and machine learning operations within neural networks. The course targets students seeking to gain experience of how numerical computation is employed in industry and research, and who want a deeper understanding of how numerical algorithms and hardware combine when solving problems. It will help develop the skills necessary to work at the hardware-software interface, and in harnessing the power of hardware accelerators and modern computer architectures to develop fast, accurate and precise analysis tools.",Yes,10,,Semester 2,3,,,,,,,,,1.0,,7.0,,1.0,,,,
COMP37111,Graphics & Virtual Environments,10,Optional,https://www.manchester.ac.uk/study/undergraduate/courses/2025/00560/bsc-computer-science/course-details/COMP37111,This Course Unit covers the principles of modern Computer Graphics from creation modelling of scenes through to animation and rendering with a particular focus on the quality and performance issues relating to the various techniques.,No,10,,Semester 1,3,,,,,,,,,,1.0,7.0,,1.0,,,,
COMP37212,Computer Vision,10,Optional,https://www.manchester.ac.uk/study/undergraduate/courses/2025/00560/bsc-computer-science/course-details/COMP37212,,No,10,,Semester 2,3,,,,,,,,,0.3,0.7,6.0,,2.0,,,,
COMP38311,Advanced Distributed Systems,10,Optional,https://www.manchester.ac.uk/study/undergraduate/courses/2025/00560/bsc-computer-science/course-details/COMP38311,Distributed Systems: The Big Picture   Categories and Characteristics   Historical Perspective   Architectural Paradigms   Cloud Computing Concepts and Economics Resource Management   Provisioning   Scheduling   Load Balancing   Energy Management   Quality of Service Big Data as an Application Driver      Big Data: Drivers and the 4Vs      Batch: MapReduce      I nteractive: NoSQL     Streaming,No,10,,Semester 1,3,,,,,,,,,,1.0,7.0,,,1.0,,,
EEEN31001,Independent Study and Technical Explanations,10,Optional,https://www.manchester.ac.uk/study/undergraduate/courses/2025/00560/bsc-computer-science/course-details/EEEN31001,"You will independently study a technical topic of your choosing* related to your degree title then clearly explain it to your peers or the public by creating learning resources (e.g. videos, workbooks, and/or interactive notes). This is an opportunity for you to explore an area of interest while building useful skills for your career. The syllabus will include material on topics such as: finding and evaluating course material, creating effective graphics, recording videos, why explaining is hard, giving useful feedback, and similar. Where possible it will also include guest lectures discussing how and how often these skills are used in industry. *(topic will be agreed between you and the unit tutor)",No,10,,Semester 1,3,,,0.24,,,,,,,,6.0,,2.0,,,,
MCEL30031,Enterprise Management for Computer Scientists,10,Optional,https://www.manchester.ac.uk/study/undergraduate/courses/2025/00560/bsc-computer-science/course-details/MCEL30031,The unit enables students to critically analyse a range of issues that business managers face using a range of business tools and techniques.  The tools are explained in lectures and students are then encouraged to apply them in separate case study sessions.  Analysis often reveals a number of conflicting factors and students are required to make judgements based on evidence that justifies their decisions.,No,10,,Variable teaching patterns,3,,,0.24,,,,,,,,6.0,,2.0,,,,
MCEL30032,Managing Finance in Enterprises for Computer Scientists,10,Optional,https://www.manchester.ac.uk/study/undergraduate/courses/2025/00560/bsc-computer-science/course-details/MCEL30032,"The unit aims to: 1. Allow students to understand and develop the necessary skills to produce a proposal to support a major project within an organisation or a business plan for a new start-up. 2. Introduce essential business finance and business risk management tools. 3. To explore resources required to form, develop and grow a business or a product line within a business. 4. To encourage students to think entrepreneurially as an essential component of their personal development.",No,10,,Semester 2,3,,1.0,,,,,,,,,6.0,,2.0,,,,
