code,title,credits,mandatory,url,description,Available as a free choice unit?,Credit rating,Offered by,Teaching period(s),Unit level,assessment_assessment_task,assessment_assignment_(2000_words),assessment_lectures,assessment_oral_assessment/presentation,assessment_practical_skills_assessment,assessment_project_output_(not_diss/n),assessment_set_exercise,assessment_verbal_discussion_of_the_topic_selected_for_brief_feedbackthere_is_also_time_set_aside_for_assignment_feedback_before_the_hand_in_date,assessment_written_assignment_(inc_essay),assessment_written_exam,independent_independent_study,scheduled_demonstration,scheduled_lectures,scheduled_practical_classes_&_workshops,scheduled_project_supervision,scheduled_supervised_time_in_studio/wksp,scheduled_tutorials
COMP10120,First Year Team Project,20,Mandatory,https://www.manchester.ac.uk/study/undergraduate/courses/2025/00560/bsc-computer-science/course-details/COMP10120,"This course unit is all about teamwork, communication, and active learning: in your team and with your tutor, you work on various tasks, thereby gaining valuable experience in teamwork and developing useful skills around communication, reflection, self-organisation, time management, independently acquiring new knowledge and skills, professional behaviour, project organisation, etc. The tasks teams work on include understanding ethical frameworks for computer science professionals, intellectual property issues, and the development of a web-based information system.",No,20,,Full year,1,,,,0.4,,,0.2,,0.4,,10.0,,2.0,3.0,,,2.0
COMP11120,Mathematical Techniques for Computer Science,20,Mandatory,https://www.manchester.ac.uk/study/undergraduate/courses/2025/00560/bsc-computer-science/course-details/COMP11120,"This course covers the fundamental maths required by Computer Science students in order to successfully complete the reminder of their courses as well as for a career in computer science. Topics covered include complex numbers, logic, probability, recursion and induction, relations, vectors, matrices and transformations.",No,20,,Full year,1,,,,,,,,,0.2,0.8,13.0,,2.0,2.0,,,
COMP11212,Fundamentals of Computation,10,Mandatory,https://www.manchester.ac.uk/study/undergraduate/courses/2025/00560/bsc-computer-science/course-details/COMP11212,"Student comments: 'The material was very interesting and I could definitely see it being useful on the near future. Overall, I enjoyed this course unit, because I felt that it extended to other course units.' - 'Through the material covered you understand better how the computer interpretes data (and generally works), and learn more about programming languages and algorithms.' - 'The course content was extremely interesting, and the PhD demonstrators were helpful and approachable. I am glad I took this module.'",Yes,10,,Semester 2,1,,,,,,,,,0.2,0.8,6.0,,1.0,1.0,,,
COMP12111,Fundamentals of Computer Engineering,10,Mandatory,https://www.manchester.ac.uk/study/undergraduate/courses/2025/00560/bsc-computer-science/course-details/COMP12111,In this course you will learn about the design of digital electronic systems from simple digital circuits to the design of a simple processor. The exercises undertaken in laboratories complement the material covered in lectures. Professional commercial software tools are used in laboratories to enter designs and simulate their behaviour.,Yes,10,,Semester 1,1,,,,,0.5,,,,,0.5,5.0,,1.0,2.0,,,
COMP13212,Data Science,10,Mandatory,https://www.manchester.ac.uk/study/undergraduate/courses/2025/00560/bsc-computer-science/course-details/COMP13212,"This course unit has two objectives. The first is to introduce the student to a range of fundamental, non-trivial algotithms, and to the techniques required to analyse their correctness and running-time. The second is to present a conceptual framework for analysing the intrinsic complexity of computational problems, which abstracts away from details of particular algorithms.",Yes,10,,Semester 2,1,,,,,0.2,,,,,0.8,6.0,,2.0,1.0,,,
COMP15111,Fundamentals of Computer Architecture,10,Mandatory,https://www.manchester.ac.uk/study/undergraduate/courses/2025/00560/bsc-computer-science/course-details/COMP15111,"The module introduces Fundamental concepts involved in Computer Architecture, which is the study and design of Computer Systems. Among others, the module discusses architecture terminology (how do we talk about computer systems), models (how do we think about computer systems), topologies (how are computers structured), how programs are executed by the hardware, and how data (whether numbers, text, colours, or polygons) are represented in hardware using only binary digits. Understanding the Fundamentals of Computer Architecture is essential for being able to reason about what exactly happens when we run a program. This is important not just for hardware designers and low level (Operating System, embedded) software developers, but for everyone that wants to create high performing, but still correct, software. As such, it is an increasingly important skill in Computer Science roles in business and finance. More generally, demystifying Computer Systems gives students a strong competitive advantage relative to developers that have no concept of what their code does, whether these developers are human ones or AI models. To be more specific, the course will help students: Understand the basic Von Neumann/Imperative computational model.   Understand the binary nature of digital computers, and how bit patterns can be used to represent such things as characters, numbers, and instructions.   Understand the essentials of the RISC-V instruction set and its registers.   Be able to understand the basics of assembly language programs.   Understand the correspondence between imperative code & data and assembly language.   Reason about the roles and interplay of the standard components of System Software (Compiler, Assembler, Library, Linker, Loader, Interpreter and Operating System), including how they are influenced by the design decision of the underlying computer hardware. Key and Cognitive skills: The module will expand the student's vocabulary with respect to the technical terminology of Computer Architecture, while also providing the cognitive foundation for understanding the design and operation of Computer Systems. Over the course of this module, the students will become able to reason about how programs are executed, how data is stored, and how to make programs faster. The student will be empowered to learn through multi-format lectures and Self-study-learning techniques. New concepts are introduced through pre-recorded Lectures, then these concepts are re-examined in a more practical context in Live Lectures. Each pre-recorded lecture comes with a set of associated formative (unmarked) questions that helps students get immediate feedback about their understanding of the material. Additionally, students can take part in an interactive quiz in the live lecture to gauge how well they are doing relative to the rest of the cohort. Question sets that test wider parts of the taught material are released every two weeks. Finally, the lectures are supported by a set of Lab assignments that expand and solidify the studentâs knowledge through a âlearning by doingâ approach.",Yes,10,,Semester 1,1,,,,,0.3,,,,,0.7,6.0,,1.0,1.0,,,
COMP15212,Operating Systems,10,Mandatory,https://www.manchester.ac.uk/study/undergraduate/courses/2025/00560/bsc-computer-science/course-details/COMP15212,,Yes,10,,Semester 2,1,,,,,0.2,,,,,0.8,3.0,,3.0,2.0,,,
COMP16321,Introduction to Programming 1,20,Mandatory,https://www.manchester.ac.uk/study/undergraduate/courses/2025/00560/bsc-computer-science/course-details/COMP16321,"This course offers a comprehensive introduction to programming through Python, one of the most accessible and widely used programming languages today. Students will explore core programming concepts including variables, control structures, functions, file handling, and modular design. The curriculum also covers practical skills such as using libraries, building graphical user interfaces, implementing animations, and visualising data. With an emphasis on writing maintainable and secure code, students will gain the confidence to analyse, design, and implement solutions to real-world problems. Through a blend of foundational theory and hands-on coding experience, this course equips learners with the essential tools and mindset to begin their journey as capable, problem-solving developers.",No,20,,Semester 1,1,,,,,0.5,,,,,0.5,14.0,,1.0,2.0,,,
COMP16412,Introduction to Programming 2,10,Mandatory,https://www.manchester.ac.uk/study/undergraduate/courses/2025/00560/bsc-computer-science/course-details/COMP16412,"This course introduces the concepts of object oriented programming using the Java 	language. The features of the object oriented paradigm will be illustrated through theoretical 	classes, and practical workshops and labs.",Yes,10,,Semester 2,1,,,,,0.5,,,,,0.5,5.0,,0.0,3.0,,,
COMP1ASP,"Careers workshop, Year 1 Computer Science",0,Mandatory,https://www.manchester.ac.uk/study/undergraduate/courses/2025/00560/bsc-computer-science/course-details/COMP1ASP,,,,,,,,,,,,,,,,,,,,,,,
COMP23311,Software Engineering 1,10,Mandatory,https://www.manchester.ac.uk/study/undergraduate/courses/2025/00560/bsc-computer-science/course-details/COMP23311,"This course covers many aspects of software engineering and contains much essential information about working with a large codebase authored by many programmers, most of whom are not around.",No,10,,Semester 1,2,,,,,0.3,,,,,0.7,3.0,,,5.0,,,
COMP23412,Software Engineering 2,10,Mandatory,https://www.manchester.ac.uk/study/undergraduate/courses/2025/00560/bsc-computer-science/course-details/COMP23412,"This course prepares you to build interactive, real-world web applications using modern development frameworks and team-based agile practices. You will work in a simulated software company, with weekly requirements from âcustomersâ (your lecturers) that range from precise to deliberately ambiguous â just like the real world. Working in teams, you will learn to break down requirements, clarify ambiguity through customer engagement, and deliver high-quality software through continuous integration and testing. Along the way, you will develop fluency in an industry-standard framework, navigating documentation and architectural patterns to solve evolving challenges. What you will gain: Real-world experience in team-based software engineering. Confidence working with a modern web development framework. Skills in requirements analysis, rapid learning, and iterative development. The ability to build and test usable, robust web applications. Hands-on experience working with APIs â both consuming and creating them. You will leave the course ready to hit the ground running in a professional development team.",No,10,,Semester 2,2,,,,,,0.5,,,,0.5,5.0,,1.0,2.0,,1.0,
COMP26020,Programming Languages & Paradigms,20,Mandatory,https://www.manchester.ac.uk/study/undergraduate/courses/2025/00560/bsc-computer-science/course-details/COMP26020,There is a variety of programming languages designed with different features aiming to address different types of problems. The unit is an advanced course for students who have already mastered one programming language. It is trying to consider the broad spectrum of different programming paradigms and how these can be used and translated.,No,20,,Full year,2,,,,,,,,,0.3,0.7,11.0,,4.0,2.0,,,
COMP26120,Algorithms and Data Structures,20,Mandatory,https://www.manchester.ac.uk/study/undergraduate/courses/2025/00560/bsc-computer-science/course-details/COMP26120,"This course unit covers fundamental material in Computer Science concerning algorithms and their correctness and performance. It is a two-semester practical course, with some video and reading resources, considerable practical experience and lab support. The student is expected to seek out material to support work on the course, thus contributing to developing ""algorithmic literacy"". The implementation of algorithms is illustrated in C, Java and Python.",No,20,,Full year,2,,,,,0.5,,,,,0.5,11.0,,2.0,4.0,,,
COMP2ASP,Managing My Future â Y2 Computer Science,0,Mandatory,https://www.manchester.ac.uk/study/undergraduate/courses/2025/00560/bsc-computer-science/course-details/COMP2ASP,,,,,,,,,,,,,,,,,,,,,,,
COMP2CARS,COMP - Careers Yr 2,0,Mandatory,https://www.manchester.ac.uk/study/undergraduate/courses/2025/00560/bsc-computer-science/course-details/COMP2CARS,,,,,,,,,,,,,,,,,,,,,,,
COMP21111,Logic and Modelling,10,Optional,https://www.manchester.ac.uk/study/undergraduate/courses/2025/00560/bsc-computer-science/course-details/COMP21111,"This is a unique course developed at the University of Manchester. It explains how implementations of logic can be used to solve a number a number of problems, such as solving hardest Sudoku puzzles in no time, analysing two-player games, or finding serious errors in computer systems",Yes,10,,Semester 1,2,,,,,,,,,0.5,0.5,5.0,,2.0,1.0,,,
COMP22111,Processor Microarchitecture,10,Optional,https://www.manchester.ac.uk/study/undergraduate/courses/2025/00560/bsc-computer-science/course-details/COMP22111,This course unit aims to reinforce and extend digital hardware development skills which are introduced in the first year. It employs industry-standard tools and languages which are used worldwide for silicon development. The UK has perhaps the strongest expertise in Europe in these areas and skills are in high demand from employers such as ARM and Imagination Technologies who provide much of the digital design for devices such as smartphones and tablet computers.,Yes,10,,Semester 1,2,,,,,0.5,,,,,0.5,5.0,,2.0,2.0,,,
COMP22712,Microcontrollers,10,Optional,https://www.manchester.ac.uk/study/undergraduate/courses/2025/00560/bsc-computer-science/course-details/COMP22712,"The module is a strong practical reinforcement of the software/hardware interface.Â  It provides experience in hardware/software codesign as well as dealing with interfacing techniques, from 'bit fiddling' to interrupt routines.Â  There is also an underpinning of operating systems and their implications in machine architecture.Â  The module uses custom designed hardware and software tools developed locally for this specific purpose.",Yes,10,,Semester 2,2,,,,,1.0,,,,,,6.0,,,2.0,,,
COMP23111,Database Systems,10,Optional,https://www.manchester.ac.uk/study/undergraduate/courses/2025/00560/bsc-computer-science/course-details/COMP23111,"This course provides a comprehensive exploration of databases, emphasizing their pivotal role in modern computing and data management. Students will learn the principles of database design, implementation, and management, with a focus on the relational model, SQL, and normalization. The curriculum also covers database integration with web and front-end systems, transaction management, security, and emerging paradigms like NoSQL. By blending theory with hands-on practice, students will develop essential skills in designing robust databases, writing advanced queries, and leveraging database technologies for real-world applications.",Yes,10,,Semester 1,2,,,,,0.7,,,,,0.3,5.0,,,2.0,,,
COMP24011,Introduction to AI,10,Optional,https://www.manchester.ac.uk/study/undergraduate/courses/2025/00560/bsc-computer-science/course-details/COMP24011,The Unit aims to make students familiar with the basic concepts and techniques of Artificial Intelligence. It provides the knowledge and understanding that underpins later course units in the subject taught in the Department.,Yes,10,,Semester 1,2,,,,,,,,,0.2,0.8,6.0,,2.0,1.0,,,
COMP24112,Machine Learning,10,Optional,https://www.manchester.ac.uk/study/undergraduate/courses/2025/00560/bsc-computer-science/course-details/COMP24112,"The world is filling up with data - billions of images online, billions of supermarket transactions, billions of events pouring out of our everyday lives.   Machine Learning is about designing algorithms capable of automatically learning patterns from this supplied data. Examples of this are in online shopping like Amazon.com - which learns what products you like to buy, or in spam detection systems, which learn what spam looks like as you tag it in your spam folder. 	  	In this course unit we will introduce you to the basics of these algorithms, implementing a basic spam filter and a handwriting recognition engine.",Yes,10,,Semester 2,2,,,,,0.3,,,,,0.7,5.0,,2.0,1.0,,,
COMP24412,Knowledge Based AI,10,Optional,https://www.manchester.ac.uk/study/undergraduate/courses/2025/00560/bsc-computer-science/course-details/COMP24412,"Intelligent systems need to be able to represent and reason about the world. This course provides an introduction to the key ideas in knowledge representation and different types of automated reasoning. The course is a mixture of theoretical and practical work: at the end of the course students will know the principles that such systems use, and they will have experience of implementing those principles in running systems.",Yes,10,,Semester 2,2,,,,,0.7,,,,,0.3,6.0,,2.0,1.0,,,
COMP25212,System Architecture,10,Optional,https://www.manchester.ac.uk/study/undergraduate/courses/2025/00560/bsc-computer-science/course-details/COMP25212,"The basic architecture of computer systems has been covered in first year course units which detailed both the instruction set architecture and the micro-architecture (hardware structure) of simple processors. Although these principles underlie the vast majority of modern computers, there is a wide range of both hardware and software techniques which are employed to increase the performance, reliability and flexibility of systems.",Yes,10,,Semester 2,2,,,,,0.3,,,,,0.7,5.0,,2.0,1.0,,,
COMP27112,Introduction to Visual Computing,10,Optional,https://www.manchester.ac.uk/study/undergraduate/courses/2025/00560/bsc-computer-science/course-details/COMP27112,"Visual Computing brings together two fundamentally important aspects of modern computing: Computer Graphics - concerned with the synthesis of images from computer models - and Image Processing, which deals with analysis and understanding of images by computers. There are now considerable overlaps between these two, traditionally separate, fields of research and their applications. 	The Visual Computing theme consists of the following course units: 	•   Year 2: Computer Graphics and Image Processing (10 credits) 	•   Year 3: Advanced Computer Graphics (10 credits) 	•   Year 3: Computer Vision (10 credits)",Yes,10,,Semester 2,2,,,,,0.3,,,,,0.7,5.0,,2.0,1.0,,,
COMP28112,Distributed Systems,10,Optional,https://www.manchester.ac.uk/study/undergraduate/courses/2025/00560/bsc-computer-science/course-details/COMP28112,"The course unit assumes that students already have a solid understanding of the main principles of computing within a single machine, have a basic understanding of the issues related to machine communication and networking, and have a notion of what distributed computing is. The syllabus will contain topics covering the fundamentals of distributed computing, its application in modern systems and issues to be considered when designing distributed systems.",Yes,10,,Semester 2,2,,,,,0.5,,,,,0.5,5.0,,2.0,1.0,,,
COMP30040,Third Year Project Laboratory,40,Mandatory,https://www.manchester.ac.uk/study/undergraduate/courses/2025/00560/bsc-computer-science/course-details/COMP30040,,No,40,Department of Computer Science,Full year,3,,,,,,,,,,,31.0,,1.0,,2.0,,
COMP31311,Giving Meaning to Programs,10,Optional,https://www.manchester.ac.uk/study/undergraduate/courses/2025/00560/bsc-computer-science/course-details/COMP31311,"Programming languages provide abstractions such as `functionsâ which are supposed to allow us to reason about the code at a high level---without running it in our heads. However, these abstractions donât necessarily behave in the way their names suggest. In this unit we show that a mathematical theory of program meanings can be developed which encompasses the counter-intuitive behaviour of computations, but preserves our ability to reason abstractly. The machinery required is significant, and delicate at times, and the unit will introduce the fundamental technical tools which help us cope with these complications.",Yes,10,,Semester 1,3,,,,,0.2,,,,,0.8,6.0,,,2.0,,,
COMP32211,Implementing System-on-Chip Designs,10,Optional,https://www.manchester.ac.uk/study/undergraduate/courses/2025/00560/bsc-computer-science/course-details/COMP32211,"The module provides an overview of the design and integration of computer systems onto chips.  Industrial-grade CAD tools are used to design a logic system, integrate it into a larger system and realise it on a programmable device.  These skills are in short supply and in high demand in the industry today.  It can also be very satisfying to build a real, visibly working system!",Yes,10,,Semester 1,3,,,,,0.5,,,,,0.5,6.0,,1.0,1.0,,,
COMP32412,The Internet of Things:  Architectures and Applications,10,Optional,https://www.manchester.ac.uk/study/undergraduate/courses/2025/00560/bsc-computer-science/course-details/COMP32412,"Augmenting objects, otherwise designed to perform a specific task, with the ability to connect to the Internet has led to a new technological paradigm called the Internet of Things (IoT). This course will introduce the students to this concept where high level tasks such as data analytics and fundamental hardware components, such as sensors and actuators are integrated to produce complex systems aimed at improving quality of life and benefit society. Considering the upcoming IoT revolution, this course unit offers a timely opportunity to familiarise yourself with the fundamental principles and primary issues that define the IoT. We put emphasis on the versatility of components that can be integrated into such systems, as well as the diversity of data types produced by the IoT edge-nodes. Successful development of IoT applications also requires communication between different levels (layers) of IoT architectures with the associated security and privacy issues.",No,10,,Semester 2,3,,,,,,,,,,1.0,6.0,,2.0,0.0,,,
COMP33312,Agile Software Pipelines,10,Optional,https://www.manchester.ac.uk/study/undergraduate/courses/2025/00560/bsc-computer-science/course-details/COMP33312,"The approach to software development known as “agile software engineering” is now well established within the industry as the most reliable and cost-effective in all but a handful of rarely occurring circumstances.  Agile approaches emphasise the early and frequent delivery of releasable software artefacts to the client, combined with disciplined but flexible approaches to project progress tracking, to the continuous and active collection of feedback on the success (or otherwise) of the work done so far and to the creation of high-quality code bases that are easy and safe to change.    In an agile project, the first usable executable artefacts will be created very early in the project’s lifetime and may be in active use while other parts of the required functionality are still in various stages of development.  New and changed functionality is delivered incrementally at short intervals throughout the duration of the project, blurring the distinction between the development and the operational project phases.   While the human processes used to manage and carry out agile software engineering are highly iterative, the artefacts produced by the processes are increasingly viewed as passing through one or more linear “pipelines”, on their journey to deployment and use in the end-user environment.  New models for the delivery of software (such as continuous delivery) depend upon a carefully configured technical pipeline as much as they do upon effective and efficient human design and feedback processes.   In this course unit, we will examine how the combination of these iterative human processes and technical development and delivery pipelines is used to create software that provides real value and return on investment for clients and end-users, while also being of sufficiently high quality to allow frequent and sometimes substantial changes throughout the software’s lifetime.",No,10,,Semester 2,3,,,,,,,,,,1.0,6.0,,,2.0,,,
COMP33511,User Experience,10,Optional,https://www.manchester.ac.uk/study/undergraduate/courses/2025/00560/bsc-computer-science/course-details/COMP33511,"The aim of this course is to give you, the student, the tools, techniques, and the mindset necessary to competently approach your first user testing and user experience job. The course is designed from a practical perspective and will enable you to take a junior role in a user experience department, or usability company, and will provide you with the overall knowledge to communicate with others and make sensible suggestions regarding UX work. The unit is not intended to be a comprehensive treaties of the subject - indeed this could be accomplished in such a short space of time - however, it will provide the basis for the students future study within the domain.",No,10,,Semester 1,3,,,,,,,,,0.5,0.5,6.0,,1.0,1.0,,,
